id,name,mnemo,logo,video,description,full_description,price,old_price,rating,course_id
1,Базовый,excelbas,excelbas.svg,kNGHvuSNNpY,Обретите уверенность при работе в Microsoft Excel 2013/2016 - лучшем редакторе электронных таблиц. Вы будете свободно ориентироваться в программе и уметь выполнять базовые действия.,"<p class=""bold"">Девиз курса:</p>\n <p>Перейдите с Экселем на ""ты""!</p><br>\n <p class=""bold"">Главная цель курса:</p>\n <p>Дать Вам ощущение уверенности при работе в программе, сделать так, чтобы Вы начали ""чувствовать её"".</p>\n <p class=""bold"">В этом курсе Вы узнаете:</p>\n <ul>\n <li class=""tab-opis-vid""><span>Как устроен интерфейс MS Excel.</span></li>\n <li class=""tab-opis-vid""><span>Как создавать и сохранять рабочие листы.</span></li>\n <li class=""tab-opis-vid""><span>Как управлять их содержимым, вводить и редактировать данные.</span></li>\n <li class=""tab-opis-vid""><span>Как форматировать числа, текст и даты.</span></li>\n <li class=""tab-opis-vid""><span>Как менять внешний вид ячеек.</span></li>\n <li class=""tab-opis-vid""><span>Как настраивать книгу для печати.</span></li>\n <li class=""tab-opis-vid""><span>Как использовать простейшие формулы.</span></li>\n <li class=""tab-opis-vid""><span> И особенности копирования формул (что делает работу в программе значительно быстрее).</span></li>\n </ul>\n <p class=""bold"">Преимущества курса:</p>\n <ul> \n <li class=""tab-opis-vid""><span>58 уроков, более 5 часов материала.</span></li>\n <li class=""tab-opis-vid""><span>25 бесплатных уроков.</span></li>\n <li class=""tab-opis-vid""><span>Курс создавали эксперты работы в программе.</span></li>\n <li class=""tab-opis-vid""><span>Курс сделан очень качественно, его приятно проходить.</span></li>\n <li class=""tab-opis-vid""><span>Легко воспринимается.</span></li>\n <li class=""tab-opis-vid""><span>Интерактивные тренировки, где Вы можете опробовать изучаемые навыки.</span></li> \n <li class=""tab-opis-vid""><span>Вы можете скачать Файлы с данными, с помощью которых мы делали этот курс.</span></li>\n </ul><br><br><text>\n <p class=""p-headline"">Не знаете, с чего начать обучение Microsoft Excel?</p>\n <p>Заходите на skill.im. Специально для вас мы подготовили интересный курс по программе Microsoft Excel. Для удобства, мы разбили обучение на три части. Но начнем с базового курса.</p><br>\n <p class=""p-headline"">Что входит в базовый курс обучения Microsoft Excel?</p>\n <p>Если вы начинающий пользователь, который только что установил себе пакет программ Microsoft Office, и вы хотите профессионально научиться пользоваться таблицами, то базовый курс – это то, что вам нужно. В нем мы обучим вас основам работы в программе.</p>\n <p>Для тех, кто уверен, что работа Microsoft Excel ему по зубам, мы подготовили предварительный тест. По сути, это свод вопросов, который поможет вам определить ваш уровень знания Microsoft Excel.</p>\n <p>Также, по мере обучения работе в программе, мы предлагаем вам проходить тематические тесты и ситуативные задания. Если с тестами все понятней, то о заданиях чуть подробней.</p>\n <p>Базируясь на знаниях, которые вы получили из курса, мы предлагаем вам выполнить ряд действий, по решению интересной и жизненной задачи в Microsoft Excel. При этом, вам даже не придется выходить из сайта.</p>\n <p>Какие темы входят в базовый курс обучения Microsoft Excel?</p>\n <p>Всего в базовом курсе по Microsoft Excel восемь разделов для начинающих. Итак, с чего начинается работа с программой.</p><br>\n <p class=""p-headline"">Первый раздел расскажет, как устроена работа в Microsoft Excel:</p>\n <p>• Зачем нужна работа в программе Microsoft Excel</p>\n <p>• Как устроен курс по Microsoft Excel</p>\n <p>• Как устроена рабочая книга в Microsoft Excel</p><br>\n <p class=""p-headline"">Из второго раздела вы узнаете, как</p>\n <p>• Создавать и сохранять рабочие книги в Microsoft Excel</p>\n <p>• Сохранять книги под другим названием</p>\n <p>• Добавлять и удалять листы</p>\n <p>• Перемещаться по рабочей книге</p><br>\n <p class=""p-headline"">В третьем разделе будет идти о редактировании данных, а именно:</p>\n <p>• Вводe числа, текста и даты</p>\n <p>• Редактировании содержимых ячеек</p>\n <p>• Отмене действий в Microsoft Excel</p>\n <p>• Работе с буфером обмена</p>\n <p>• Поиске по книге</p>\n <p>• Вставке и удалении строк и столбцов</p>\n <p>• Скрытии листов и строк</p><br>\n <p class=""p-headline"">В четвертом разделе мы будем говорить об основах работы с формулами:</p>\n <p>• Как устроены базовые математические операции</p>\n <p>• Функция СУММ</p>\n <p>• Копирование формул и функция</p>\n <p>• Отображение формул на листе</p><br>\n <p class=""p-headline"">В пятом разделе мы предлагаем вам ознакомиться с инструментарием для форматирования рабочего листа:</p>\n <p>• Как выделять ячейки</p>\n <p>• Переносить текст в ячейках</p>\n <p>• Объединять ячейки</p>\n <p>• Форматировать ячейки</p><br>\n <p class=""p-headline"">Из шестого раздела вы узнаете о дополнительных возможностях управления:</p>\n <p>• Как скрывать листы</p>\n <p>• Навигация по рабочей книге и раскраска ярлычков</p>\n <p>• Одновременное изменение данных в нескольких листах</p><br>\n <p class=""p-headline"">Седьмой раздел мы посвятили простейшим математическими функциями:</p>\n <p>• Функция суммирования</p>\n <p>• Мода и медиана</p>\n <p>• Различные функции подсчета</p><br>\n </text>",1530,2295,4.64815,1
2,Продвинутый,exceladv,exceladv.svg,i1nUaVrSVmI,"Обучение самым востребованным возможностям Microsoft Excel 2013/2016. Это должен знать каждый, кто сталкивается с реальными задачами.","<p class=""bold"">Девиз курса:</p>\n <p>Я могу всё!</p><br>\n <p class=""bold"">Главная цель курса:</p>\n <p>Превратить Excel в простой и понятный рабочий инструмент, с помощью которого Вы сможете экономить время и решать множество реальных задач.</p>\n <p class=""bold"">В этом курсе Вы узнаете:</p>\n \t<ul>\n \t\t<li class=""tab-opis-vid""><span>Как защищать данные в таблицах.</span></li>\n \t\t<li class=""tab-opis-vid""><span>Как работать с картинками и прочими графическими объектами.</span></li>\n \t\t<li class=""tab-opis-vid""><span>Как вставлять результаты вычислений в графические объекты.</span></li>\n \t\t<li class=""tab-opis-vid""><span>Как создавать и настраивать диаграммы.</span></li>\n \t\t<li class=""tab-opis-vid""><span>Как сортировать и фильтровать данные.</span></li>\n \t\t<li class=""tab-opis-vid""><span>Как добавлять промежуточные итоги.</span></li>\n \t\t<li class=""tab-opis-vid""><span>Как профессионально использовать функцию ЕСЛИ.</span></li>\n \t\t<li class=""tab-opis-vid""><span>Как форматировать ячейки в зависимости от данных в них.</span></li>\n \t\t<li class=""tab-opis-vid""><span>Что такое мгновенное заполнение и как им пользоваться.</span></li>\n \t</ul>\n <p class=""bold"">Преимущества курса:</p>\n \t<ul>\n \t\t<li class=""tab-opis-vid""><span>52 урока, около 6 часов материала.</span></li>\n \t\t<li class=""tab-opis-vid""><span>Курс создавали эксперты работы в программе.</span></li>\n \t\t<li class=""tab-opis-vid""><span>Курс сделан очень качественно, его приятно проходить.</span></li>\n \t\t<li class=""tab-opis-vid""><span>Легко воспринимается.</span></li>\n \t\t<li class=""tab-opis-vid""><span>Интерактивные тренировки, где Вы можете опробовать изучаемые навыки.</span></li>\n \t\t<li class=""tab-opis-vid""><span>Вы можете скачать Файлы с данными, с помощью которых мы делали этот курс.</span></li>\n \t</ul><br><br> <text>\n <p class=""p-headline"">Ищете качественный самоучитель по работе в Microsoft Excel?</p>\n <p>Специально для тех, кто знает основы работы в Microsoft Excel, но хочет детальней разобраться в этой программе, skill.im подготовила курс по работе в этой программе.</p>\n <p>Зачем он нужен? Затем, что он позволит вам стать уверенным пользователем и применять навыки при выполнении различных задач в кратчайшие сроки. Пройдите его и никто больше не назовет вас чайником. А самое главное – это то, что учиться со skill.im не только полезно, но и интересно.</p><br>\n <p class=""p-headline"">Что входит в курс по MS Excel?</p>\n <p>Второй этап нашего самоучителя посвящен более сложным темам, поэтому, если вы еще никогда не пользовались экселем, то мы рекомендуем начать с базового курса.</p>\n <p>Так вот, в этот этап входит семь разделов.</p><br>\n <p>Первый раздел курса посвящен сложному форматированию:</p>\n <p>• темы в Excel</p>\n <p>• Добавлению примечаний</p>\n <p>• Созданию списков быстрого заполнения</p><br>\n <p class=""p-headline"">Во втором разделе мы поговорим о защите данных:</p>\n <p>• Как защитить данные на листе</p>\n <p>• Как частично защитить данные</p>\n <p>• пароль</p><br>\n <p class=""p-headline"">Третий целиком и полностью посвящен графическим объектам:</p>\n <p>• Добавлению картинок в Excel</p>\n <p>• Объектам типа «SmartArt»</p>\n <p>• Вставке фигур в Excel</p>\n <p>• Группировке объектов в Excel</p>\n <p>• Использованию объектов совместно с математическими формулами</p><br>\n <p class=""p-headline"">В четвертом пункте самоучителя мы затронем такую важную тему, как диаграммы в Excel:</p>\n <p>• Что такое рекомендуемые диаграммы в Excel</p>\n <p>• Несколько способов создания диаграмм в Excel</p>\n <p>• Изменения типа диаграмм</p>\n <p>• Форматирования элементов диаграммы</p>\n <p>• Добавления линий тренда</p>\n <p>• Спарклайны в Excel</p><br>\n <p class=""p-headline"">Пятый пункт самоучителя посвящен теме «Excel в качестве базы данных». Из него вы узнаете о:</p>\n <p>• Фиксации строк и столбцов в Excel</p>\n <p>• Фиксации строк и столбцов при печати</p>\n <p>• Сортировке данных в Excel</p>\n <p>• Фильтрах для отбора данных</p>\n <p>• Удалении дублирующихся записей в Excel</p>\n <p>• Получении данных с веб-страницы.</p><br>\n <p class=""p-headline"">В шестом разделе самоучителя речь пойдут о более сложных формулах:</p>\n <p>• Функция ЕСЛИ</p>\n <p>• ЕСЛИ для работы с ошибками</p>\n <p>• Функция ЕСЛИОШИБКА</p>\n <p>• Вложенные функции ЕСЛИ</p>\n <p>• оператор И совместно с ЕСЛИ</p>\n <p>• РАЗНДАТ – спрятанная функция</p>\n <p>• Функция ТЕКСТ для форматирования чисел и дат</p>\n <p>• Функции для работы с датами</p>\n <p>• Мгновенное заполнение</p>\n <p>• Определение ранга в множестве значений</p>\n <p>• Функции СЧЕТЕСЛИ, СРЗНАЧЕСЛИ и СУММЕСЛИ</p><br>\n <p class=""p-headline"">Последний раздел этого самоучителя мы отвели под условное форматирование:</p>\n <p>• Форматирование ячейки в зависимости от ее содержимого в Excel</p>\n <p>• Вставка небольших диаграмм и цветовых индикаторов</p>\n <p>• Создание правил форматирования с нуля</p>\n <p>• Управление правилами форматирования.</p><br>\n <p>Помимо всего, мы хотим добавить, что каждый урок в самоучителе происходит на конкретных, жизненных примерах. Это помогает вам не только освоить полученное знание, но и увидеть затем, как оно применяется на практике при работе с таблицами.</p><br>\n <p>Почему именно самоучитель от skill.im?</p>\n <p>Дело в том, что в наш самоучитель по Excel входят не только видеоуроки, но еще и тесты, и симуляции.</p>\n <p>Тесты позволяют вам закрепить полученные навыки. А симуляции – применять их на практике, при выполнение различных ситуативных заданий.</p>\n <p>Вместе с уроками, они делают наш самоучитель максимально разнообразным и интересным. Так что, станьте экспертами по работе в Excel прямо сейчас.</p>\n </text>",2900,4350,4.66667,1
3,Мастерский,excelmas,excelmas.svg,gFZdP_2ZPpA,Станьте профессионалом! Легко используйте MS Excel 2013/2016 для решения даже самых сложных задач.,"<p class=""bold"">Девиз курса:</p>\n <p>Дао Excel</p><br>\n <p class=""bold"">Главная цель курса:</p>\n <p>Стать настоящим профессионалом в использовании MS Excel 2013. Изучить программу настолько глубоко, чтобы решать задачи любой сложности.</p>\n <p class=""bold"">В этом курсе Вы узнаете:</p> \n \t<ul> \n \t<li class=""tab-opis-vid""><span>Как производить поиск значений с помощью функций.</span></li>\n \t<li class=""tab-opis-vid""><span>Как работать со временем и текстом.</span></li>\n \t<li class=""tab-opis-vid""><span>Множество полезных математических функций.</span></li>\n \t<li class=""tab-opis-vid""><span>Что такое сценарии и представления.</span></li>\n \t<li class=""tab-opis-vid""><span>Как работать с массивами.</span></li>\n \t<li class=""tab-opis-vid""><span>Как проверять правильность формул.</span></li>\n \t<li class=""tab-opis-vid""><span>Как профессионально использовать сводные таблицы и сводные диаграммы.</span></li><li class=""tab-opis-vid""><span>Как производить анализ и поиск решений.</span></li>\n </ul>\n <p class=""bold"">Преимущества курса:</p>\n <ul> \n \t<li class=""tab-opis-vid""><span>81 уроков, более 5 часов материала.</span></li>\n \t<li class=""tab-opis-vid""><span>Курс создавали эксперты работы в программе.</span></li>\n \t<li class=""tab-opis-vid""><span>Курс сделан очень качественно, его приятно проходить.</span></li>\n \t<li class=""tab-opis-vid""><span>Легко воспринимается.</span></li>\n \t<li class=""tab-opis-vid""><span>Интерактивные тренировки, где Вы можете опробовать изучаемые навыки.</span></li>\n \t<li class=""tab-opis-vid""><span>Вы можете скачать Файлы с данными, с помощью которых мы делали этот курс.</span></li>\n \t</ul>",3480,5220,4.70968,1
