id,name,mnemo,logo,video,description,full_description,price,old_price,rating,course_id
10,Продвинутый,vbaadv,vbaadv.svg,qDip1yPUUv0,"подойдет для пользователей, которые хотят научиться писать программы на VBA","<p class=""bold"">Девиз курса:</p>\n<p>Программировать легко!</p>\n<br>\n</ul>\n\n <p class=""bold"">Главная цель курса:</p>\n <p>Начать писать настоящие программы на VBA. \n <p class=""bold"">В этом курсе Вы узнаете:</p>\n \t<ul>\n \t\t<li class=""tab-opis-vid""><span>Как писать собственные функции и использовать их в Excel.</span></li>\n \t\t<li class=""tab-opis-vid""><span>Как создавать разветвлённую логику с помощью условных операторов.</span></li>\n \t\t<li class=""tab-opis-vid""><span>Что такое циклы, какие они бывают и для чего служат.</span></li>\n \t\t<li class=""tab-opis-vid""><span>Как ещё больше ""соединиться"" с Excel, используя события.</span></li>\n \t\t<li class=""tab-opis-vid""><span>Как находить ошибки и отлаживать свои программы.</span></li>\n \t</ul>\n\n<p class=""bold"">Преимущества курса:</p>\n<ul>\n <li class=""tab-opis-vid""><span>32 урока, более 1,5 часов материала.</span></li> \n<li class=""tab-opis-vid""><span>Курс создавали эксперты работы в программе.</span></li>\n<li class=""tab-opis-vid""><span>Курс сделан очень качественно, его приятно проходить.</span></li>\n<li class=""tab-opis-vid""><span>Легко воспринимается.</span></li>\n<li class=""tab-opis-vid""><span>Интерактивные тренировки, где Вы можете опробовать изучаемые навыки.</span></li>\n<li class=""tab-opis-vid""><span>Вы можете скачать Файлы с данными, с помощью которых мы делали этот курс.</span></li>\n</ul>",1840,2760,5.00000,4
11,Создание интерфейса,vbamas,vbamas.svg,qDip1yPUUv0,"подойдет для тех, кто хочет научиться делать интерфейсные элементы на VBA","<p class=""bold"">Девиз курса:</p>\n<p>Программы с человеческим лицом.</p>\n<br>\n<p class=""bold"">В этом курсе вы узнаете:</p>\n<ul>\n <li class=""tab-opis-vid""><span>Как создавать пользовательские интерфейсы с помощью VBA.</span></li>\n <li class=""tab-opis-vid""><span>Другими словами, как добавлять и настраивать кнопки, многочисленные поля ввода и прочие интерактивные элементы.</span></li>\n <li class=""tab-opis-vid""><span>Как сделать Вашу программу удобнее (в том числе и для себя :) ).</span></li>\n</ul>\n<p class=""bold"">Особенности курса:</p>\n<ul>\n <li class=""tab-opis-vid""><span>Курс построен на решении реальной задачи.</span></li> \n <li class=""tab-opis-vid""><span>Мы рассматриваем все основные интерактивные элементы, доступные в VBA.</span></li> \n <li class=""tab-opis-vid""><span>Изучаем не только их работу по отдельности, но и их взаимодействие, ведь интерфейс состоит именно из взаимодействующих элементов.</span></li>\n <li class=""tab-opis-vid""><span>Обращаем внимание на мелочи и нюансы.</span></li>\n</ul>\n <p class=""bold"">Преимущества курса:</p>\n <ul>\n \t<li class=""tab-opis-vid""><span>22 урока более 1,5 часов материала.</span></li>\n \t<li class=""tab-opis-vid""><span>Курс создавали эксперты работы в программе.</span></li>\n \t<li class=""tab-opis-vid""><span>Курс сделан очень качественно, его приятно проходить.</span></li>\n \t<li class=""tab-opis-vid""><span>Легко воспринимается.</span></li>\n \t<li class=""tab-opis-vid""><span>Интерактивные тренировки, где Вы можете опробовать изучаемые навыки.</span></li>\n \t<li class=""tab-opis-vid""><span>Вы можете скачать Файлы с данными, с помощью которых мы делали этот курс.</span></li>\n </ul>",1400,2100,5.00000,4
12,Базовый,projectbas,projectbas.svg,,"подойдет для пользователей, которые хотят изучить основы планирования в MS Project.","<p class='bold'>Девиз курса:</p>\n<p>Первые шаги к порядку!</p><br>\n<p class='bold'>Главная цель курса:</p>\n<p>Изучить основы планирования проектов в MS Project. Разобраться с основными принципами и понятиями.</p>\n</ul>\n<p class='bold'>Преимущества курса:</p>\n<ul>\n <li class='tab-opis-vid'><span>Курс объединяет в себе изучение MS Project, основы проектного менеджмента и разбор реальных примеров.</span></li>\n <li class='tab-opis-vid'><span>В курсе используются абстрактные задачи там, где ""легенда"" отвлекает от содержания урока.</span></li>\n <li class='tab-opis-vid'><span>И прототипы реальных проектов там, где понимание выигрывает от смысла задач и их взаимосвязей.</span></li>\n</ul><br><br><text>\n <p class=""p-headline"">Ищете обучающий курс для новичков по Microsoft Рroject?</p>\n <p>Тогда skill.im – это правильный выбор. У нас вы найдете качественный и интересный курс по работе в Microsoft Рroject и обязательно станете специалистом по этой программе. Множество крупных компаний из Москвы, Киева и Питера уже приобрели наш курс по Рroject и успешно используют эту программу для управления своими проектами.</p>\n <p>Как устроен курс по Microsoft Рroject?</p>\n <p>Для удобства, мы поделили весь курс на три этапа: базовый курс, продвинутый и мастерский. Пройдя все три этапа, вы сможете уверенно сказать, что вы специалист в этой программе.</p>\n <p>Каждый этап подходит для людей с определенным уровнем знаний. Если вы не знаете, с чего начать изучение Microsoft Рroject, то мы рекомендуем вам пройти предварительный тест. Он проверит ваши фундаментальные знания в управлении проектами и с его помощью вы сможете подобрать подходящий вам уровень.</p><br>\n <p class=""p-headline"">Что входит в базовый курс по Microsoft Рroject?</p>\n <p>В базовом курсе мы расскажем вам об основах работы с программой. Всего, в начальный курс вошло девять разделов.</p>\n <p>Первый раздел посвящен первым шагам и знакомству с Microsoft Рroject, а именно:</p>\n <p>• Основам проектного менеджмента</p>\n <p>• Планированию проектов в Microsoft Рroject</p>\n <p>• Гиду по интерфейсу</p>\n <p>• Панели быстрого доступа</p><br>\n <p class=""p-headline"">На втором этапе мы начнем работать с файлом проекта и научимся:</p>\n <p>• Создавать проект</p>\n <p>• Сохранять проект</p>\n <p>• Открывать проект</p>\n <p>• Открывать недавние проекты</p><br>\n <p class=""p-headline"">Важным составляющим при работе с Microsoft Рroject являются таблицы. Именно ним мы посвятили третий раздел и в нем расскажем вам о:</p>\n <p>• Выделении ячеек</p>\n <p>• Добавлении и удалении задач</p>\n <p>• Редактировании задач</p>\n <p>• Отмене и возврате действий</p>\n <p>• Копировании и перемещении данных</p>\n <p>• Форматировании данных</p>\n <p>• Изменении ширины строк и столбцов</p><br>\n <p class=""p-headline"">Предположим, вы предприниматель из Москвы. И хотите грамотно распланировать весь проект, учитывая различные факторы. В таком случае, вам не обойтись без четвертого этапа: календаря проекта. Из него вы узнаете:</p>\n <p>• Все о длительности задач</p>\n <p>• Диаграмме Ганта</p>\n <p>• Настройке исключений в календаре проекта</p>\n <p>• Пересчет величин длительности</p><br>\n <p class=""p-headline"">На пятом этапе мы расскажем вам о связи между задачами. Более детально:</p>\n <p>• Как работают связи</p>\n <p>• Добавление связей</p>\n <p>• Работа со связями</p><br>\n <p class=""p-headline"">Шестой раздел очень короткий, но не менее важный. Из него вы узнаете о режиме планирования задач.</p>\n <p>• Какие бывают режимы планирования</p>\n <p>• Как между ними переключаться</p><br>\n <p class=""p-headline"">На седьмом этапе мы расскажем вам о структуре проекта, а именно:</p>\n <p>• Дате начала и окончания</p>\n <p>• О вехах</p>\n <p>• Что такое суммарные задачи</p>\n <p>• Как с ними работать</p>\n <p>• Об отображении структуры проекта</p><br>\n <p class=""p-headline"">Предпоследний раздел посвящен ресурсам:</p>\n <p>• Как с ними работать</p>\n <p>• Добавление трудовых ресурсов</p>\n <p>• Материальные и затратные ресурсы</p>\n <p>• Календарь ресурсов</p><br>\n <p class=""p-headline"">Ну и наконец последний этап посвящен назначениям:</p>\n <p>• Загруженность ресурсов</p>\n <p>• Трудозатраты</p>\n <p>• Механика назначений</p>\n <p>• Назначение ресурсов</p><br>\n <p class=""p-headline"">Из чего состоит обучение?</p>\n <p>Уникальность наших курсов заключается в том, что обучение состоит не из одних лишь видео. Мы понимаем, как важно сделать обучение интересным и поэтому разнообразили его несколькими вещами.</p>\n <p>Во-первых, это интерактивные тренажеры, которые помогут вам закрепить обучение. С их помощью вы сможете решить ситуационное задание прямо на сайте.</p>\n <p>Во-вторых, тесты, цель которых проверить, насколько хорошо был усвоен материал. Причем тесты делятся на два типа: промежуточные и экзаменационные. Цель первых, проверить, как вы усвоили материал конкретного раздела. В то время как цель вторых, дать оценку усвоенному материалу в целом.</p>\n <p>И, в-третьих, для тех, кто прошел курс целиком, мы подготовили возможность получить сертификат государственного образца. Но чтобы его получить – нужно сначала закончить весь курс целиком и сдать все тесты. Хотя, мы уверены, что с нашими уроками у вас все получится. Этот сертификат подтвердит то, что вы действительно стали специалистом по проджекту.</p>\n <p>Почему стоит выбрать курс именно от skill.im?</p>\n <p>Дело в том, что мы очень ответственно подходим к написанию каждого ролика. Все они базируются на кейсах, которые встречаются чуть ли не ежедневно в работе различных компаний. Плюс, в некоторых видео вы сможете попробовать себя в роли управляющего из Москвы, которому нужно решить определенные задачи в Microsoft Рroject.</p>\n <p>Только качественное обучение программе Microsoft Рroject</p>\n <p>Выбирая наш курс по этой программе, вы обеспечиваете себя интересным материалом и обязательно превратитесь в высококвалифицированного специалиста. Наши ролики не только приятно смотреть, но и слушать. Не зря, нас выбрало множество людей из стран СНГ. Ведь skill.im это только качественное онлайн-обучение.</p>\n </text>",2150,3225,5.00000,5
13,Продвинутый,projectadv,projectadv.svg,,"подойдет для пользователей, которые хотят научиться использовать Project не только для планирования проекта, но и для контроля его выполнения.","<p class='bold'>Девиз курса:</p>\n<p>Полный вперёд!</p><br>\n<p class='bold'>Главная цель курса:</p>\n<p>Научиться использовать MS Project не только во время планирования проекта, но и во время его\nвыполнения, а также освоить продвинутые методы планирования и возможности настройки программы под свои\nнужды.</p>\n</ul>\n<p class='bold'>В курсе Вы научитесь:</p>\n<ul>\n <li class='tab-opis-vid'><span>Настраивать и фильтровать таблицы, чтобы гибко отображать только нужные Вам данные.</span></li>\n <li class='tab-opis-vid'><span>Создавать связи между задачами с учётом различных обстоятельств.</span></li>\n <li class='tab-opis-vid'><span>Отслеживать ход выполнения проекта.</span></li>\n <li class='tab-opis-vid'><span>Сравнивать запланированные показатели и реальные.</span></li>\n <li class='tab-opis-vid'><span>Экспортировать / импортировать проект в Excel.</span></li>\n</ul>",2500,3750,5.00000,5
14,Мастерский,projectmas,projectmas.svg,,освоить все тонкости управления проектом и автоматизировать рутинные действия.,"<p class='bold'>Девиз курса:</p>\n<p>""Предвидеть"" - значит ""управлять"".</p><br>\n<p class='bold'>Главная цель курса:</p>\n<p>Освоить тонкости эффективного планирования в MS Project, а также научиться автоматизировать рутинные действия, чтобы больше времени уделять, собственно, управлению.</p>\n<p class='bold'>В этом курсе Вы узнаете:</p>\n<ul>\n <li class='tab-opis-vid'><span>Как осуществлять продвинутое планирование проекта.</span></li>\n <li class='tab-opis-vid'><span>Как создавать и использовать настраиваемые поля.</span></li>\n <li class='tab-opis-vid'><span>Как решать ресурсные конфликты.</span></li>\n <li class='tab-opis-vid'><span>Как эффективно работать со стоимостью проекта.</span></li>\n <li class='tab-opis-vid'><span>Как анализировать освоенный объём.</span></li>\n <li class='tab-opis-vid'><span>Как и зачем объединять несколько подпроектов в один.</span></li>\n <li class='tab-opis-vid'><span>Как создавать отчёты.</span></li>\n <li class='tab-opis-vid'><span> Как распечатывать проекты.</span></li>\n</ul>\n<p class='bold'>Преимущества курса:</p>\n<ul>\n <li class='tab-opis-vid'><span>57 уроков, более 4 часов материала.</span></li>\n <li class='tab-opis-vid'><span>Курс создавали эксперты работы в программе.</span></li>\n <li class='tab-opis-vid'><span>Курс сделан очень качественно, его приятно проходить.</span></li>\n <li class='tab-opis-vid'><span>Легко воспринимается.</span></li>\n <li class='tab-opis-vid'><span>Интерактивные тренировки, где вы можете опробовать изучаемые навыки.</span></li>\n <li class='tab-opis-vid'><span>Вы можете скачать Файлы с данными, с помощью которых мы делали этот курс.</span></li>\n</ul>",2840,4260,4.50000,5
15,Базовый,onenotebas,onenotebas.svg,,"подходит для пользвателей, которым нужно удобное место, чтобы организовать свою рабочую и личную информацию","<p class='bold'>Девиз курса:</p>\n<p>Упорядочивай и властвуй!</p><br>\n<p class='bold'>Цель курса:</p>\n<p>Помочь Вам организовать собственную цифровую библиотеку, чтобы Ваша информация всегда хранилась в полном порядке, и Вы в любой момент могли легко найти то, что нужно. </p>\n<p class='bold'>В этом курсе Вы узнаете:</p>\n<ul>\n <li class='tab-opis-vid'><span>Как устроен интерфейс OneNote.</span></li>\n <li class='tab-opis-vid'><span>Как упорядочить информацию с помощью записных книжек, разделов и страниц.</span></li>\n <li class='tab-opis-vid'><span>Как создавать текстовые заметки.</span></li>\n <li class='tab-opis-vid'><span>Как эффективно организовать рабочее пространство.</span></li>\n <li class='tab-opis-vid'><span>Как добавлять в заметки различные объекты.</span></li>\n </ul>\n<p class='bold'>Преимущества курса:</p>\n<ul>\n <li class='tab-opis-vid'><span>27 бесплатных уроков, более 1,5 часа материала.</span></li>\n <li class='tab-opis-vid'><span>Курс создавали эксперты работы в программе.</span></li>\n <li class='tab-opis-vid'><span>Каждый урок посвящен решению конкретных задач.</span></li>\n <li class='tab-opis-vid'><span>Легкий и понятный стиль изложения.</span></li>\n </ul>",250,375,5.00000,6
16,Базовый,outlookbas,outlookbas.svg,,"подойдет для пользователей, которые думают, что в Outlook – это самая обычная почтовая программа.","<p class='bold'>Девиз курса:</p>\n<p>Outlook – больше, чем просто почта. </p><br>\n<p class='bold'>Главная цель курса:</p>\n<p>Познакомить Вас с основными возможностями Outlook’a и показать, как эта программа может помочь Вам в организации рабочего процесса.</p>\n<p class='bold'>В этом курсе Вы узнаете:</p>\n<ul>\n <li class='tab-opis-vid'><span>Как устроен интерфейс программы.</span></li>\n <li class='tab-opis-vid'><span>Что происходит с электронным письмом после отправки.</span></li>\n <li class='tab-opis-vid'><span>Как создавать, сохранять и отправлять сообщения.</span></li>\n <li class='tab-opis-vid'><span>Как отвечать на письма и пересылать сообщения.</span></li>\n <li class='tab-opis-vid'><span>Как создавать и удалять контакты.</span></li>\n <li class='tab-opis-vid'><span>Как отмечать свои планы в календаре.</span></li>\n <li class='tab-opis-vid'><span>Как создавать и удалять задачи.</span></li>\n <li class='tab-opis-vid'><span>Куда можно быстро записать свои мысли и идеи.</span></li>\n</ul>\n<p class='bold'>Преимущества курса:</p>\n<ul>\n <li class='tab-opis-vid'><span>37 бесплатных уроков, более 2 часов материала.</span></li>\n <li class='tab-opis-vid'><span>Курс создавали эксперты работы в программе.</span></li>\n <li class='tab-opis-vid'><span>Каждый урок посвящён решению конкретных задач.</span></li>\n <li class='tab-opis-vid'><span>Легкий и понятный стиль изложения.</span></li>\n </ul>",720,1080,4.75000,7
